idx,question,answer,context
body-part_3789,Vai trò của tầng sinh môn là gì trong cơ thể?,"Tầng sinh môn đóng vai trò quan trọng trong hoạt động tình dục, đi tiểu và đại tiện.","Tầng sinh môn thường được định nghĩa là vùng bề mặt ở cả nam và nữ giữa xương mu và xương cụt. Tầng sinh môn nằm dưới phần sâu nhất của đáy chậu, nằm giữa hai chân. Đó là một khu vực hình kim cương bao gồm các cấu trúc nằm giữa xương mu và xương cụt,bao gồm phần đáy chậu và các cấu trúc xung quanh. Đối với nữ còn bao gồm cả âm đạo. Đối với nam, nó bao gồm phần bìu và có thể bao gồm cả dương vật tùy cách phân loại khác nhau của từng ngành và thời kì khác nhau. Các định nghĩa của nó có khác nhau: nó chỉ có thể đề cập đến các cấu trúc bề ngoài trong khu vực này hoặc nó có thể được sử dụng để bao gồm cả các cấu trúc bề ngoài và sâu. Đáy chậu tương ứng với đầu ra của khung chậu. - Có thể dùng mặt phẳng ngang dọc để phân chia không gian tầng sinh môn thành hai khối hình tam giác. Bao gồm tam giác niệu dục ở phía trước, chứa bìu và dương vật ở nam hoặc âm đạo ở nữ. Phần tam giác phía sau chứa hậu môn."
body-part_4441,Mốc giải phẫu nào của xương mác có thể sờ thấy rõ nhất?,Mắt cá ngoài là mốc giải phẫu của xương mác có thể sờ thấy rõ nhất.,"Chỏm xương mác: Rất nông. Có thể sờ thấy ở mặt ngoài sau của đầu gối, nằng ngang mức lồi củ chày. Thân xương mác: 1/4 xa có thể sờ thấy được. Mắt cá ngoài: Khối xương nổi rõ ở mặt ngoài cổ chân"
body-part_4666,Quá trình diễn ra như thế nào để trao đổi chất lỏng giữa thân đốt sống và đĩa đệm?,Sự trao đổi chất lỏng giữa thân đốt sống và đĩa đệm được thực hiện nhờ quá trình khuếch tán qua vòng sợi.,"Chức năng của mâm sụn bao gồm: Bảo vệ thân đốt sống: Nhờ vào cơ chế dẫn truyền trọng lượng. Mặt trên và mặt dưới của thân đốt sống chịu lực ép rất mạnh. Tuy nhiên, xương sẽ không bị tổn thương nếu mâm sụn còn nguyên vẹn. Trao đổi chất lỏng giữa thân đốt sống và đĩa đệm: Đĩa đệm người trưởng thành là một cấu trúc hoàn toàn không có mạch máu. Sự dinh dưỡng và bài tiết chất thải được thực hiện nhờ quá trình khuếch tán qua vòng sợi. Qua đó, mâm sụn giúp cho sự trao đổi chất lỏng giữa đĩa đệm và thân đốt sống kế cận được đảm bảo."
body-part_3222,Phần tròn trước nhất cùng thùy trán của não được gọi là gì?,"Phần này được gọi là cực trán, là một trong ba cực của đại não.","Thùy trán hay frontal lobe, thùy frontal là phần não kiểm soát các kỹ năng nhận thức quan trọng ở con người. Chẳng hạn như biểu hiện cảm xúc, giải quyết vấn đề, trí nhớ, ngôn ngữ, phán đoán và hành vi tình dục. Về bản chất, nó là “bảng điều khiển” tính cách và khả năng giao tiếp của con người. Thùy não này là thùy lớn nhất trong bốn thùy chính của não ở động vật có vú nói chung. Nó nằm ở phía trước của mỗi bán cầu (phía trước thùy đỉnh và thùy thái dương). Thùy não này được ngăn cách với thùy đỉnh bởi một rãnh giữa các mô được gọi là rãnh trung tâm. Và từ thùy thái dương bằng một rãnh sâu hơn gọi là rãnh bên (khe nứt Sylvian). Phần tròn trước nhất của frontal lobe (mặc dù không được xác định rõ) được gọi là cực trán, một trong ba cực của đại não. Xem thêm: Đau đầu khi ho: Nên hiểu thế nào cho đúng? Đây là một vị trí thường xảy ra chấn thương sọ não nhất. Tổn thương thùy này có thể tạo ra những thay đổi về tính cách, hạn chế biểu hiện trên khuôn mặt. Đồng thời gặp khó khăn trong việc giải thích môi trường của một người. Chẳng hạn như không thể đánh giá đầy đủ rủi ro và nguy hiểm."
body-part_3,Acid dạ dày là gì?,"Acid dạ dày là acid Chlorhidric (HCl), một loại acid có tính ăn mòn cực mạnh.","Dịch tiêu hóa dạ dày là một hỗn hợp nhiều chất. Có nhiều chất tiết trước, trong và luôn luôn được tiết ra khi ăn. Chúng gồm có acid dạ dày, các dịch tiêu hóa thủy phân protein và glucid. Trong phạm vi bài viết, ta sẽ nói chủ đề về acid dạ dày là chủ yếu. Acid dạ dày là acid Chlorhidric (HCl). Đây là một loại acid có tính ăn mòn cực mạnh. Acid dạ dày do tế bào thành ở dạ dày tiết ra. Tế bào thành có hệ thống bơm H+ luôn liên tục bơm ion này vào lòng dạ dày. Khi nhắc đến độ acid, ta nhắc đến độ pH hay đúng hơn là nồng độ của chất acid đó. Dạ dày có nồng độ acid khá cao, thường vào khoảng 0.0150-0.0001 mol/L (tương ứng với độ pH từ 1.5 đến 3). Với nồng độ cao này, có thể nói acid dạ dày có thể ăn mòn được cả những kim loại như sắt và nhôm."
body-part_3036,"Trong phương pháp ghép allograft (đồng loại), từ đâu các bác sĩ sẽ lấy vật liệu cấy ghép xương?","Trong phương pháp ghép allograft (đồng loại), các bác sĩ sẽ lấy vật liệu cấy ghép xương tử người hiến chứ không phải từ chính người bệnh.","Phương pháp này dùng mô ghép lấy từ người hiến chứ không phải chính người đó. Allografts (đồng loại) thường có thể điều trị các vùng tổn thương lớn hơn so với autograft (tự thân) . Mặc dù bác sĩ có thể thực hiện thủ thuật này để thúc đẩy quá trình lành thương. Nhưng sụn có thể phát triển với tốc độ chậm. Các bác sĩ có thể sẽ khuyến nghị vật lý trị liệu và các kỹ thuật khác trong thời gian chờ đợi để tăng cường khả năng vận động. Sụn xương là một cấu trúc đóng vai trò quan trọng trong hoạt động dẻo dai, linh hoạt và chịu lực của cơ thể. Tuy nhiên sụn là mô vô mạch, do đó quá trình lành thương diễn ra tương đối chậm. Hiện có nhiều phương pháp giúp thúc đẩy và khắc phục quá trình lành thương sụn nhanh hơn."
body-part_1165,Cơ chế nào khiến đột biến gen APC dẫn đến sự hình thành polyp bất thường trong ruột kết?,"Đột biến gen APC dẫn đến sản xuất một phiên bản ngắn bất thường, không có chức năng của protein APC. Loại protein ngắn này không thể ngăn chặn sự phát triển quá mức của tế bào, do đó dẫn đến hình thành các khối u bất thường (polyp) trong ruột kết.","Hơn 700 đột biến trong gen APC đã được xác định trong các gia đình mắc các dạng bệnh đa polyp tuyến gia đình. Hầu hết các đột biến này dẫn đến việc sản xuất một phiên bản ngắn bất thường, không có chức năng của protein APC. Loại protein ngắn này không thể ngăn chặn sự phát triển quá mức của tế bào. Do đó dẫn đến hình thành các khối u bất thường (polyp) trong ruột kết, có thể trở thành ung thư. Đột biến phổ biến nhất trong FAP là mất 5 nucleotide trong gen APC. Đột biến này làm thay đổi trình tự của các axit amin trong protein APC. Hầu hết những người bị FAP sẽ phát triển ung thư đại trực tràng. Nhưng số lượng polyp và khung thời gian mà chúng trở thành ung thư phụ thuộc vào vị trí của đột biến trong gen APC. Vị trí của đột biến cũng xác định: liệu một cá nhân bị FAP có khuynh hướng phát triển các khối u desmoid hay không?"
body-part_952,Nước tiểu và tinh dịch có thoát ra cùng lúc không?,"Không, nước tiểu và tinh dịch không thoát ra cùng lúc.","Thể xốp là một ống khác của dương vật có chứa niệu đạo bên trong. Niệu đạo là nơi thoát ra của nước tiểu và tinh dịch. Tuy nhiên, nước tiểu và tinh dịch không thoát ra cùng một lúc. Phần cuối của ống nở ra tạo nên đầu dương vật còn được gọi là quy đầu."
body-part_1221,"Sau khi có kết quả xét nghiệm BRCA, bước tiếp theo cần làm là gì?","Sau khi có kết quả xét nghiệm BRCA, bước tiếp theo cần làm là làm việc với bác sĩ và chuyên gia tư vấn di truyền để quyết định các bước tiếp theo, bao gồm tầm soát ung thư vú và các liệu pháp tiềm năng khác như liệu pháp hormone hoặc phẫu thuật.","Ung thư buồng trứng xảy ra ở khoảng 1,3% phụ nữ trong dân số nói chung. Đối với những người có đột biến BRCA1, 39% dự kiến ​​sẽ phát triển ung thư buồng trứng. Trong khi 11% đến 17% những người có đột biến BRCA2 sẽ phát triển bệnh.2 Có những bệnh ung thư khác cũng có thể liên quan đến đột biến BRCA. Chẳng hạn như: ung thư tuyến tiền liệt, ung thư tuyến tụy và thậm chí là ung thư phổi.2 Mặc dù đột biến gen BRCA là một trong những dấu hiệu cho thấy nguy cơ ung thư vú. Tuy nhiên bạn cần nhớ rằng: Đột biến gen chưa hẳn đã có ung thư. Sau khi có kết quả BRCA, bạn có thể làm việc với bác sĩ và chuyên gia tư vấn di truyền để quyết định các bước tiếp theo. Bao gồm : tầm soát ung thư vú và các liệu pháp tiềm năng khác. Chẳng hạn như liệu pháp hormone hoặc phẫu thuật. Bạn nên trao đổi kỹ với bác sĩ. Điều quan trọng là bạn cảm thấy tự tin và hiểu biết về những gì bạn cần làm sau khi kiểm tra BRCA."
body-part_3007,Sụn xương được cấu tạo từ những thành phần phân tử nào?,Sụn xương được cấu tạo chủ yếu từ proteoglycan và collagen.,"Chức năng của sụn khớp phụ thuộc vào thành phần phân tử của chất nền ngoại bào (ECM); bao gồm chủ yếu là proteoglycan và collagen. Như đã đề cập trước đây, proteoglycan chính trong sụn là aggrecan, tạo thành các tập hợp lớn với hyaluronan và mang điện tích âm để giữ nước trong mô. Collagen (chủ yếu là loại II), hoạt động để hạn chế các proteoglycan và giúp nó giữ vững cấu trúc. Do đó, ECM có chức năng phản ứng với các lực kéo, cắt và nén mà sụn phải chịu trong quá trình sử dụng cơ học như dáng đi bình thường hoặc các chuyển động chịu trọng lượng. Ngoài ra, một glycoprotein được gọi là bôi trơn có nhiều trong lớp bề ngoài của sụn. Chất lỏng hoạt dịch đóng một vai trò quan trọng trong việc bôi trơn sinh học và bảo vệ sụn."
body-part_3013,Độ dày của sụn khớp khác nhau như thế nào בין הקבצים?,Độ dày của sụn khớp khác nhau giữa các khớp.,"Độ dày của sụn khớp khác nhau giữa các khớp. Ví dụ, ở cổ tay, sụn có thể dày dưới 1 mm, trong khi ở một số vùng của đầu gối, sụn có thể dày tới 6 mm."
body-part_727,Một số tác dụng phụ của việc bổ sung DHEA có thể liên quan đến sự thay đổi về nồng độ của hormone nào?,Một số tác dụng phụ của việc bổ sung DHEA có thể liên quan đến sự thay đổi nồng độ của hormone testosterone và estrogen trong cơ thể.,"- Da nhờn và mụn trứng cá, cũng như da dày lên.
- Rụng tóc.
- Đau dạ dày.
- Huyết áp cao.
- Thay đổi chu kỳ kinh nguyệt.
- Rậm lông mặt ở phụ nữ.
- Giọng nói trầm hơn ở phụ nữ.
- Mệt mỏi.
- Nghẹt mũi.
- Đau đầu. - Nhịp tim nhanh hoặc không đều.
- Mất ngủ.
- Những thay đổi bất lợi về mức cholesterol.
- Một số tác dụng phụ này có thể là do DHEA nâng cao mức testosterone và estrogen trong cơ thể của một người. Các chuyên gia y tế cảnh báo rằng ít dữ liệu nói về tác hại khi bổ sung DHEA nhiều và kéo dài. Do đó, các chất bổ sung DHEA không nên được dùng lâu dài mà không tham khảo ý kiến của chuyên gia chăm sóc sức khỏe."
body-part_373,Bạch cầu hạt gồm những loại nào?,"Bạch cầu hạt gồm ba loại chính là bạch cầu đa nhân trung tính, bạch cầu ái kiềm và bạch cầu ái toan.","Đây là những bạch cầu có các hạt nhỏ trong bào tương khi được nhuộm và quan sát dưới kính hiển vi quang học. Hơn nữa, bạch cầu hạt còn được phân thành ba loại nữa, đặt tên theo các thuộc tính nhuộm màu của từng loại. Đó là: - Bạch cầu đa nhân trung tính (neutrophil): Thực ra chúng chỉ có một nhân mà thôi, bao gồm nhiều đoạn nối với nhau bởi một dây nối mảnh hoặc một eo nhỏ.
- Bạch cầu ái kiềm (basophil): Nhân thường chia hai đoạn, bào tương có vài hạt lớn bắt màu xanh tím trên tiêu bản nhuộm Giemsa.
- Bạch cầu ái toan (eosinophil): các hạt màu da cam trong bào tương và nhân thường chia hai múi."
body-part_4811,Huyết áp ĐM là gì?,Huyết áp ĐM là lực của máu tác động lên một đơn vị diện tích thành ĐM.,"Huyết áp ĐM là lực của máu tác động lên một đơn vị diện tích thành ĐM. Máu chảy được trong ĐM là kết quả của hai lực đối lập: lực đẩy máu của tim và lực cản của thành động mạch. Trong đó, lực đẩy máu của tim mạnh hơn. Do đó, máu chảy được trong động mạch với một tốc độ và áp suất nhất định. Đơn vị đo huyết áp là: mmHg hoặc Kpa (KiloPascal). 1 KPa = 7,5 mmHg."
body-part_4346,Buồng trứng nằm ở vị trí nào?,Buồng trứng nằm ở hai bên tử cung và dựa vào thành chậu trong một khu vực được gọi là hố buồng trứng.,"Mỗi người phụ nữ có hai buồng trứng.1 Buồng trứng có hình bầu dục, mỗi bên dài khoảng 4cm và nằm ở hai bên tử cung và dựa vào thành chậu trong một khu vực được gọi là hố buồng trứng. Mỗi buồng trứng được cố định tại chỗ bởi các lớp dây chằng gắn vào tử cung. Buồng trứng có hai chức năng sinh sản chính trong cơ thể - Sản xuất tế bào trứng để thụ tinh.
- Sản xuất 2 nội tiết tố sinh sản chính, estrogen và progesterone.1 Các bệnh lý có thể gặp ở buồng trứng - Ung thư buồng trứng.
- U nang buồng trứng.
- Hội chứng buồng trứng đa nang.
- Suy buồng trứng nguyên phát.
- Xoắn buồng trứng."
body-part_2704,Có những cách nào để phòng ngừa bệnh đường hô hấp?,"Tập thể dục đều đặn, đảm bảo chế độ dinh dưỡng, uống đủ nước, không hút thuốc lá, thuốc lào, xì gà, tránh các thức ăn đã từng gây dị ứng, hạn chế tiếp xúc với khói bụi, khói thuốc lá.","- Tập thể dục đều đặn, phù hợp sức khỏe. Trong mùa đông, không nên đi tập quá sớm (trước 5 giờ sáng) và quá muộn (sau 21 giờ). Lưu ý luôn giữ ấm cơ thể vào mùa đông.
- Đảm bảo chế độ dinh dưỡng đủ năng lượng, cân đối để tăng cường sức mạnh cho hệ thống miễn dịch. Tăng cường rau xanh, trái cây tươi để bổ sung vitamin cho cơ thể.
- Uống đủ nước hàng ngày tránh làm khô đường hô hấp. Như vậy sẽ tối ưu cho chức năng bảo vệ đường hô hấp.
- Không hút thuốc lá, thuốc lào, xì gà.
- Tránh các thức ăn đã từng gây dị ứng. Với người đã bị dị ứng với phấn hoa, lông chó mèo, mạt bụi nhà, cần hạn chế tiếp xúc với các tác nhân trên. Hạn chế tiếp xúc với khói bụi, khói thuốc lá. Xem thêm: Những dấu hiệu ung thư thực quản mà bạn nên biết"
body-part_3916,"Trong chu kỳ kinh nguyệt, tử cung đóng vai trò gì?","Trong chu kỳ kinh nguyệt, tử cung đóng vai trò quan trọng trong việc điều chỉnh lưu lượng máu cũng như hỗ trợ cho hiện tượng kinh nguyệt diễn ra suôn sẻ thông qua quá trình bong ra của lớp niêm mạc tử cung."," Như đã trình bày, lớp niêm mạc của tử cung bong ra sẽ gây hiện tượng kinh nguyệt. Tử cung cũng hỗ trợ điều chỉnh lưu lượng máu trong chu kỳ kinh nguyệt. "
body-part_3230,Điểm đặc trưng của vỏ não phía trước là gì?,"Vỏ não phía trước có thể được coi là “vỏ não hành động”, nó được dành cho hành động của loại này hay loại khác như cử động xương, cử động mắt, kiểm soát giọng nói, biểu hiện cảm xúc, …","Toàn bộ vỏ não phía trước có thể được coi là “vỏ não hành động”, cũng như vỏ não sau được coi là “vỏ não cảm giác”. Nó được dành cho hành động của loại này hay loại khác: Cử động xương, cử động mắt, kiểm soát giọng nói, biểu hiện cảm xúc. Ở người, phần lớn nhất của vỏ não trước, tức là vỏ não trước trán, chịu trách nhiệm về hành động tinh thần có mục đích bên trong, thường được gọi là lý luận hoặc tổng hợp trước trán. Chức năng của frontal lobe liên quan đến khả năng dự đoán các hệ quả trong tương lai do các hành động hiện tại gây ra. Thùy trán cũng đóng một phần quan trọng trong việc tích hợp các ký ức dài hơn dựa trên nhiệm vụ được lưu trữ trên não."
body-part_3340,Ung thư thực quản giai đoạn đầu có biểu hiện như thế nào?,Ung thư thực quản giai đoạn đầu có thể không có bất kỳ triệu chứng nào.,"Có hai loại ung thư chính. Ung thư biểu mô tế bào vảy là một ung thư có thể xảy ra trong các tế bào vảy lót của thực quản. Loại chính khác là ung thư biểu mô tuyến xảy ra trong các tuyến hoặc biểu mô cột. Ở giai đoạn đầu, ung thư có thể không có bất kỳ triệu chứng nào. Khi nghiêm trọng, ung thư có thể gây tắc nghẽn, khiến việc nuốt bất kỳ loại thực phẩm rắn nào trở nên rất khó khăn và gây sụt cân. Ung thư thường được kiểm soát bằng xạ trị, hóa trị và cũng có thể bằng phẫu thuật cắt bỏ một phần thực quản."
body-part_2852,Mầm răng của răng cối lớn thứ ba (RCL 3) phát triển như thế nào?,"Mầm răng của răng cối lớn thứ ba (RCL 3) đôi khi không hình thành hoặc không đủ lực để mọc, trong trường hợp nào thì RCL 3 cũng không thể mọc bình thường.","Răng cối lớn thứ nhất (RCL 1/ Răng 6) mọc lúc khoảng 6 tuổi, nên còn lược gọi là “răng 6 tuổi”. Đây là răng vĩnh viễn đầu tiên mọc trong miệng. Răng cối lớn thứ hai (RCL 2/ răng 7) mọc vào khoảng 12 tuổi, nên còn được gọi là “răng 12 tuổi”. Răng cối lớn thứ ba (RCL 3), thường được gọi là “răng khôn”. Nó mọc vào thời điểm khá thất thường, khoảng từ 18 đến 25 tuổi. Đôi khi mọc sớm hơn hoặc trễ hơn, hoặc không mọc do không có mầm răng hay do không mọc được (răng ngầm)."
body-part_3147,Thế giới hình ảnh được lập bản đồ như thế nào bởi thùy chẩm?,Thùy chẩm giúp ích cho cả lý luận không gian và trí nhớ hình ảnh bằng cách lập bản đồ thế giới hình ảnh.,"- Lập bản đồ thế giới hình ảnh, giúp ích cho cả lý luận không gian và trí nhớ hình ảnh. Hầu hết thị giác liên quan đến một số loại trí nhớ, vì việc quét trường thị giác yêu cầu bạn nhớ lại điều mà bạn đã nhìn thấy chỉ một giây trước.
- Xác định thuộc tính màu của các mục trong trường trực quan.
- Đánh giá khoảng cách, kích thước và độ sâu.
- Nhận biết các kích thích thị giác, các khuôn mặt và đồ vật đặc biệt quen thuộc.
- Truyền thông tin thị giác đến các vùng não khác để các thùy não đó có thể mã hóa ký ức. Đồng thời gán ý nghĩa, tạo ra các phản ứng ngôn ngữ và vận động phù hợp.
- Liên tục phản hồi thông tin từ thế giới xung quanh.
- Nhận dữ liệu hình ảnh thô từ các cảm biến tri giác trong võng mạc của mắt."
body-part_1535,Hội chứng đau vùng phức hợp (CRPS) là gì?,"CRPS là một hội chứng đa dạng, phức tạp liên quan đến phản ứng nghiêm trọng và kéo dài bất thường của hệ thần kinh giao cảm đối với cơn đau sau chấn thương.","Hội chứng đau vùng phức hợp (CRPS), còn được gọi là Rối loạn giao cảm phản xạ (RSD). Đây là một hội chứng đa dạng, phức tạp. Nó có liên quan đến phản ứng nghiêm trọng và kéo dài bất thường của hệ thần kinh giao cảm đối với cơn đau sau chấn thương. Mặc dù có nhiều dạng lâm sàng khác nhau, CRPS thường biểu hiện như một biến chứng của chấn thương đối với dây thần kinh và / hoặc cơ. Xảy ra sau phẫu thuật (ví dụ như phẫu thuật giải phóng ống cổ tay). Hoặc do vận động quá mức."
body-part_1170,Nguyên nhân nào dẫn đến sự phát triển của một tỷ lệ nhỏ bệnh ung thư dạ dày?,Đột biến soma trong gen APC có thể liên quan đến sự phát triển của một tỷ lệ nhỏ bệnh ung thư dạ dày.,Đột biến soma trong gen APC có thể liên quan đến sự phát triển của một tỷ lệ nhỏ bệnh ung thư dạ dày.
body-part_3133,Điều kiện để lọc máu được áp dụng là gì?,"Lọc máu được chỉ định khi mất khoảng 85%-90% chức năng thận, thể hiện qua chỉ số GFR (tốc độ lọc cầu thận) dưới 15.","Đây là phương pháp điều trị thay thế chức năng của thận bình thường. Lọc máu có thể được thực hiện khi mất khoảng 85% -90% chức năng thận, được biểu thị bằng mức lọc cầu thận (GFR) dưới 15. Lọc máu loại bỏ các chất thải chuyển hóa cũng như nước và natri dư thừa và duy trì nồng độ các chất hóa học phù hợp trong cơ thể."
body-part_4637,Những loại vắc-xin nào khác ngoài vi-rút HPV mà phụ nữ nên tiêm chủng nếu có thể?,"Nếu có thể, phụ nữ nên tiêm vắc xin viêm gan siêu vi B, C để phòng ngừa các bệnh về viêm gan.","Phụ nữ nên cần tiêm vắc-xin vi-rút HPV, vi-rút liên quan đến ung thư cổ tử cung. Ngoài ra, nếu có thể, tiêm vắc xin viêm gan siêu vi B, C cũng thật sự cần thiết. Quan hệ tình dục cũng có thể lây lan các bệnh về viêm gan."
body-part_2819,Phần nào của ruột non có cấu tạo ngắn nhất?,"Tá tràng, dài từ 20 cm đến 25 cm.","Ruột non được chia thành ba phần cấu trúc. Tá tràng Là một cấu trúc ngắn, dài từ 20 cm đến 25 cm và có hình chữ “C”. Nó bao quanh đầu tụy. Nó nhận được các enzym tiêu hóa từ dạ dày, cùng với dịch tụy từ tuyến tụy và dịch mật từ gan. Các enzyme tiêu hóa phân hủy protein và mật nhũ hóa chất béo thành các nhũ dịch. Tá tràng chứa các tuyến của Brunner tiết dịch có tính kiềm, giàu chất nhầy có chứa bicarbonate. Những chất tiết này, kết hợp với bicarbonate từ tuyến tụy, trung hòa các axit dạ dày có trong enzym dạ dày. Xem thêm: Viêm tá tràng có nguy cơ tiến triển thành ung thư không? Hỗng tràng Là phần giữa của ruột non, nối tá tràng với hồi tràng. Nó dài khoảng 2,5 m. Sản phẩm tiêu hóa (đường, axit amin và axit béo) được hấp thụ vào máu ở đây. Hồi tràng Phần cuối cùng của ruột non. Nó dài khoảng 3 m và chứa các nhung mao tương tự như hỗng tràng. Nó hấp thụ chủ yếu vitamin B12 và axit mật, cũng như bất kỳ chất dinh dưỡng nào còn lại."
