idx,question,answer,context
drug_2902,Tương tác thuốc giữa Antacil và Tetracyclin liên quan đến điều gì?,Tương tác thuốc giữa Antacil và Tetracyclin làm giảm tác dụng của kháng sinh.,"Thuốc Antacil kháng axit nên làm tăng pH dạ dày, làm thay đổi môi trường trong dạ dày. Từ đó có thể làm thay đổi tác dụng các thuốc có tính axit yếu hoặc bazơ yếu khác. Cụ thể: - Antacil làm giảm tác dụng của thuốc có tính axit yếu. Chẳng hạn như thuốc: Digoxin, Phenytoin, Chlorpromazin, Izoniazid.
- Antacil làm tăng sự hấp thu các thuốc có tính bazơ yếu, gây độc tính hay phản ứng có hại. Ví dụ như thuốc Pseudoephedrin, Levodopa. Ngoài ra, Antacil có thể kết hợp với các thuốc khác trên bề mặt làm giảm sinh khả dụng và giảm tác dụng của thuốc. Ví dụ Antacil kết hợp với kháng sinh Tetracyclin làm giảm tác dụng của kháng sinh. Các thuốc kháng axit làm tăng pH nước tiểu. Từ đó làm ảnh hưởng đến mức độ bài tiết các thuốc, ức chế sự bài tiết của thuốc có tính bazơ (Quinidin, Amphetamin) và làm tăng sự bài tiết của thuốc có tính axit (Salicylat)."
drug_56,Thuốc A.T Calmax nên được bảo quản ở đâu?,"Thuốc A.T Calmax nên được bảo quản ở nơi khô ráo, thoáng mát.","Nên bảo quản thuốc ở nơi khô ráo, thoáng mát, nhiệt độ không quá 30°C và tránh ánh nắng trực tiếp. Trên đây là bài viết về công dụng, cách dùng và tác dụng phụ của thuốc A.T Calmax. Hy vọng các thông tin trong bài viết trên sẽ có ích cho bạn và gia đình. Tuy nhiên, bạn vẫn nên đến gặp bác sĩ để được tư vấn nguy cơ và lợi ích trước khi sử dụng thuốc."
drug_5827,Thuốc Bioflora có thể được sử dụng cho những người đang đặt catheter tĩnh mạch trung ương không?,"Không, thuốc Bioflora chống chỉ định cho những người đang đặt catheter tĩnh mạch trung ương.","Chống chỉ định dùng thuốc Bioflora trong các trường hợp: - Mẫn cảm với một trong các thành phần của thuốc.
- Người bệnh đặt catheter tĩnh mạch trung ương."
drug_2958,"Nếu quên một liều Antibio và liều đã quên kề với liều kế tiếp, bạn nên làm gì?","Nếu quên một liều Antibio và liều đã quên kề với liều kế tiếp, hãy bỏ qua liều đã quên và dùng theo đúng lịch trình dùng sản phẩm.","- Dùng ngay sau khi nhớ ra đã quên liều.
- Nếu liều đã quên kề với liều kế tiếp. Bỏ qua liều đã quên và dùng theo đúng lịch trình dùng sản phẩm.
- Không dùng gấp đôi liều với mục đích bù vào liều đã quên."
drug_1747,Alphachymotrypsin 4200 Mebiphar có công dụng gì?,"Alphachymotrypsin 4200 Mebiphar có công dụng kháng viêm và điều trị phù nề do áp xe, loét, do chấn thương hay sau phẫu thuật.","Alphachymotrypsin 4200 Mebiphar là thuốc dùng để kháng viêm và điều trị phù nề do áp xe, loét, do chấn thương hay sau phẫu thuật."
drug_5804,Thuốc nào có thể gây ra tương tác khi dùng chung với Bilomag?,"Thuốc chống đông máu như heparin, dẫn xuất của coumarin (warfarin, acenocoumarol), thuốc chống kết tập tiểu cầu: Clopidogrel, ticlopidine, acid acetylsalicylic, dipyridamol.","Một số thuốc sau đây có thể gây tương tác khi dùng chung với Bilomag: - Thuốc chống đông máu như heparin và các dẫn xuất của coumarin (warfarin, acenocoumarol).
- Thuốc chống kết tập tiểu cầu: Clopidogrel, ticlopidine, acid acetylsalicylic, dipyridamol.
- Một số thực phẩm như tỏi và nhân sâm có thể làm tăng nguy cơ chảy máu khi dùng chung.
- Trazodone (thuốc chống trầm cảm).
- Thuốc ức chế bơm proton như omeprazol.
- Nifedipine (thuốc hạ huyết áp và điều trị tim mạch).
- Thuốc lợi tiểu thiazide như hydroclorothiazide.
- Tipranavir (sử dụng trong liệu pháp kết hợp để điều trị kháng virus HIV – 1)."
drug_2367,Trong trường hợp nào thì không thể sử dụng Amlodipin Domesco?,"Amlodipin Domesco chống chỉ định trong các trường hợp sau: hạ huyết áp nghiêm trọng, sốc (bao gồm sốc tim), tắc nghẽn đường ra thất trái (ví dụ: hẹp động mạch chủ nặng), suy tim huyết động không ổn định sau nhồi máu cơ tim cấp.","Chống chỉ định sử dụng amlodipin trên các bệnh nhân sau:2 - Nhạy cảm với các dẫn chất dihydropyridin, amlodipin hoặc bất kỳ thành phần nào của thuốc.
- Hạ huyết áp nghiêm trọng.
- Sốc (bao gồm sốc tim).
- Tắc nghẽn đường ra thất trái (ví dụ: hẹp động mạch chủ nặng).
- Suy tim huyết động không ổn định sau nhồi máu cơ tim cấp."
drug_7940,Chalme được đào thải qua con đường nào ạ?,Thuốc Chalme được đào thải qua đường phân.,"Chalme được sử dụng để điều trị viêm loét dạ dày và giảm triệu chứng ợ nóng, khó tiêu, rối loạn dạ dày. Thuốc được hấp thu tại ruột và bài tiết qua phân.1"
drug_4651,Các triệu chứng của sử dụng quá liều Babi B.O.N bao gồm những gì?,"Các triệu chứng của sử dụng quá liều Babi B.O.N bao gồm: yếu cơ, ngủ gà, mệt mỏi, đau đầu, chán ăn, buồn nôn, nôn, khô mồm, ...","Việc sử dụng thuốc quá liều có thể gây nguy hiểm cho người sử dụng. Các triệu chứng của việc sử dụng quá liều thuốc có thể kể đến như: yếu cơ, ngủ gà, mệt mỏi, đau đầu, chán ăn, buồn nôn, nôn, khô mồm,… Do đó, trong trường hợp uống quá liều hoặc có các triệu chứng của việc sử dụng thuốc quá liều, hãy ngưng thuốc và đến ngay các cơ quan y tế gần nhất để được hỗ trợ kịp thời.5"
drug_7230,Carsantin có tác dụng gì trong điều trị suy tim sung huyết?,Carsantin có tác dụng làm giảm tiến triển của bệnh khi điều trị suy tim sung huyết nhẹ hoặc vừa do thiếu máu cục bộ.,"Với thành phần chính Carvedilol, Carsantin được chỉ định trong các trường hợp tăng huyết áp, suy tim sung huyết hay thiếu máu cục bộ:1 - Tăng huyết áp: có thể sử dụng đơn trị hoặc phối hợp với các thuốc khác đặc biệt là các nhóm thuốc lợi tiểu (thiazid).
- Đau thắt ngực.
- Điều trị suy tim sung huyết nhẹ hoặc vừa do thiếu máu cục bộ, có thể phối hợp thêm Digitalis, nhóm thuốc lợi tiểu hoặc nhóm thuốc ACEI (nhóm thuốc ức chế men chuyển) để làm giảm tiến triển của bệnh."
drug_559,Acnekyn có gây thiếu máu không?,"Có, thiếu máu là tác dụng phụ ít gặp của Acnekyn.","Bất kì thuốc nào cũng có tác dụng phụ, khi sử dụng Acnekyn 500 mg bạn có thể gặp các triệu chứng với các tần suất sau: - Thỉnh thoảng xảy ra tình trạng như: Ban da và những phản ứng dị ứng khác. Ban đỏ hoặc mày đay, có thể nặng hơn và có thể kèm theo thương tổn niêm mạc và sốt do thuốc. Người có mẫn cảm với salicylat thì rất hiếm có trường hợp mẫn cảm với acetaminophen và những thuốc có liên quan. Trong một số ít trường hợp riêng lẻ, acetaminophen đã gây giảm bạch cầu trung tính, giảm tiểu cầu và giảm toàn thể huyết cầu.
- Ít gặp: Buồn nôn, nôn, loạn tạo máu (giảm bạch cầu trung tính, giảm toàn thể huyết cầu, giảm bạch cầu), thiếu máu, bệnh thận, độc tính thận khi lạm dụng dài ngày.
- Hiếm gặp: Phản ứng quá mẫn. Khi bạn gặp tác dụng phụ ngoài ý muốn thì nên dừng sử dụng sản phẩm. Tốt nhất là thông báo cho bác sĩ và đến cơ sở y tế gần nhất phòng khi tình trạng càng diễn biến nặng."
drug_1999,Thuốc Amaryl có thể dùng phối hợp với insulin không?,Thuốc Amaryl có thể dùng phối hợp với insulin để giảm đường huyết trên bệnh nhân không thể kiểm soát tình trạng tăng đường huyết khi ăn kiêng và tập thể dục kết hợp với việc uống thuốc giảm đường huyết.,"Thuốc Amaryl được chỉ định dùng trong trường hợp sau: - Sử dụng như một trị liệu phụ trợ cho việc ăn kiêng và tập thể dục để giảm đường huyết trên bệnh nhân đái tháo đường type 2 ở người lớn mà việc ăn kiêng và tập thể dục đơn thuần không thể kiểm soát được tình trạng tăng đường huyết.
- Sử dụng chung với metformin khi ăn kiêng, tập thể dục, và dùng Amaryl hoặc metformin đơn thuần không kiểm soát được đường huyết một cách thỏa đáng.
- Sử dụng phối hợp với insulin để giảm đường huyết trên bệnh nhân không thể kiểm soát tình trạng tăng đường huyết khi ăn kiêng và tập thể dục kết hợp với việc uống thuốc giảm đường huyết. Sử dụng phối hợp glimepiride và insulin có thể làm tăng khả năng hạ đường huyết."
drug_306,"Khi sử dụng thuốc Acehasan, ngoài thuốc Acehasan, bạn được khuyến cáo không nên sử dụng những thuốc nào?","Khi sử dụng thuốc Acehasan, ngoài thuốc Acehasan, bạn được khuyến cáo không nên sử dụng những thuốc ho khác hoặc bất cứ thuốc nào làm giảm bài tiết phế quản.","- Buồn nôn, nôn.
- Buồn ngủ, nhức đầu, ù tai.
- Viêm miệng, chảy nước mũi nhiều, ran ngáy.
- Phát ban, mày đay.
- Co thắt phế quản. Bạn cũng không nên dùng đồng thời các thuốc ho khác hoặc bất cứ thuốc nào làm giảm bài tiết phế quản trong thời gian điều trị bằng Acehasan."
drug_9710,"Theo nhà sản xuất, Didicera dạng viên hoàn có thể sử dụng được với đối tượng nào?","Theo nhà sản xuất, Didicera dạng viên hoàn có thể sử dụng được với phụ nữ cho con bú.","Theo nhà sản xuất, Didicera dạng viên hoàn có thể sử dụng được với phụ nữ cho con bú.1"
drug_5948,Sử dụng thuốc Bisilkon sau bao lâu thì có thể nhận thấy hiệu quả?,"Tùy thuộc vào vị trí, mức độ và đáp ứng của bệnh nhân với thuốc, thời gian điều trị khác nhau nên khó có thể nhận biết hiệu quả của thuốc Bisilkon sau bao lâu.","Bôi thuốc 2 lần/ngày vào buổi sáng và buổi tối. Để đạt được hiệu quả điều trị, nên bôi thuốc đều đặn, thường xuyên. Thời gian điều trị khác nhau tùy thuộc vào vị trí, mức độ và đáp ứng của bệnh nhân với thuốc. Nếu sau 3 – 4 tuần điều trị với Bisilkon mà không thấy có dấu hiệu cải thiện thì nên ngưng thuốc và thông báo với bác sĩ của mình."
drug_3881,Atorvastatin có tác dụng gì đối với nồng độ các thành phần lipid trong máu người bệnh?,"Atorvastatin giúp giảm nồng độ các thành phần lipid “xấu” (cholesterol, triglcerid) và tăng lipid “có lợi” (HDL) trong máu người bệnh.","Atorvastatin giúp giảm nồng độ các thành phần lipid “xấu” (cholesterol, triglcerid) và tăng lipid “có lợi” (HDL) trong máu người bệnh."
drug_3234,"Ngoài các tác dụng phụ thông thường, bệnh nhân dùng Artrodar có thể gặp thêm tình trạng nào?",Bệnh nhân dùng Artrodar đôi khi sẽ xuất hiện tình trạng nước tiểu sậm màu.,"Các tác dụng phụ thường gặp trong giai đoạn đầu dùng thuốc là đau bụng, phân lỏng và tiêu chảy. Các triệu chứng này sẽ giảm đi theo thời gian. Bệnh nhân dùng Artrodar đôi khi sẽ xuất hiện tình trạng nước tiểu sậm màu. Tác dụng phụ trên gan như tổn thương gan cấp tính cũng được báo cáo gần đây trong giai đoạn hậu mại của thuốc.1 Lưu ý, nếu trong quá trình sử dụng thuốc có xảy ra bất kỳ triệu chứng bất thường nào phải báo ngay cho bác sĩ để có hướng giải quyết kịp thời."
drug_98,Tại sao cần phải bảo quản A.T.P đúng cách?,Việc bảo quản A.T.P đúng cách có thể giúp thuốc duy trì hiệu quả điều trị.,"Bảo quản thuốc A.T.P tại nơi khô ráo, tránh ánh sáng và đảm bảo nhiệt độ dưới 30°C. Ngoài ra, bố mẹ cần để thuốc tránh xa tầm tay trẻ em vì một số bé nghĩ thuốc là kẹo. Điều này sẽ dẫn đến một số hậu quả khôn lường và đáng tiếc. Bài viết trên đã cung cấp cho bạn nhiều thông tin quan trọng trong quá trình dùng thuốc A.T.P. Bạn có thể tham khảo thêm từ chuyên gia hoặc các nhân viên y tế để sử dụng thuốc an toàn và đạt kết quả tốt nhất. Nếu còn bất kỳ thắc mắc nào về thuốc và cách sử dụng thuốc, bạn hãy để lại bình luận để được hỗ trợ tư vấn giải đáp nhé!"
drug_6146,Cách bảo quản của thuốc Bluemint là gì?,"Bluemint cần được bảo quản nơi khô ráo, thoáng mát, nhiệt độ dưới 30°C và tránh ánh sáng.","- Bảo quản nơi khô ráo, thoáng mát, nhiệt độ dưới 30°C và tránh ánh sáng.
- Để xa tầm tay của trẻ em. Hy vọng qua bài viết này bạn biết được thông tin sử dụng thuốc Bluemint. Hãy gọi ngay cho bác sĩ nếu xuất hiện bất kỳ một triệu chứng nào bất thường để có thể được xử trí và hỗ trợ kịp thời nhé!"
drug_9545,Tại sao người áp dụng chế độ ăn kiêng muối cần thận trọng khi sử dụng thuốc Davita Bone Sugar free?,"Người áp dụng chế độ ăn kiêng muối cần thận trọng khi sử dụng thuốc Davita Bone Sugar free vì thuốc này có thể làm tăng lượng natri trong cơ thể, dẫn đến tình trạng tích nước và tăng huyết áp.","Cần thận trọng khi dùng thuốc với:1 - Người áp dụng chế độ ăn kiêng muối.
- Người suy thận nhẹ hay có tiền căn sỏi thận.
- Người suy giảm chức năng thận.
- Người bị thiểu năng tuyến cận giáp.
- Người có bệnh tim mạch như bệnh tim, xơ vữa động mạch.
- Người bị suy hô hấp hay nhiễm toan máu."
drug_8608,Thuốc Clorpheniramin được bán dưới dạng gì?,"Thuốc Clorpheniramin được bán dưới dạng hộp, mỗi hộp có 10 vỉ x 20 viên nén dài.","Thuốc Clorpheniramin 4 có giá tham khảo 40.000 VNĐ/hộp 10 vỉ x 20 viên nén dài. Thuốc được bán tại nhiều nhà thuốc và giá thành thực tế có thể dao động tùy vào thời điểm và nơi bán. Thuốc Clorpheniramin có tác dụng chống dị ứng, sử dụng để điều trị các triệu chứng của viêm mũi dị ứng. Bệnh nhân cần tham khảo ý kiến bác sĩ trước khi sử dụng và xử lí kịp thời nếu có các tác dụng phụ xảy ra."
drug_181,"Trong trường hợp dùng quá liều A.t Vildagliptin, mục tiêu của phương pháp điều trị hỗ trợ là gì?",Mục tiêu của phương pháp điều trị hỗ trợ là loại bỏ chất chuyển hóa chính do thủy phân thuốc bằng thẩm phân máu.,"Nếu một người sử dụng thuốc với liều cao hơn chỉ định, họ có thể gặp các triệu chứng sau: đau cơ, dị cảm nhẹ và thoáng qua, sốt, phù và tăng lipase thoáng qua,… Trong trường hợp người bệnh dùng quá liều thuốc này, phương pháp điều trị hỗ trợ được khuyến cáo. Bác sĩ sẽ loại bỏ chất chuyển hóa chính do thủy phân thuốc bằng thẩm phân máu."
drug_9255,Thuốc Crinone (progesterone) có tên gọi đầy đủ là gì?,Tên đầy đủ của thuốc là gel âm đạo Crinone 8%.,"Tên đầy đủ của thuốc là gel âm đạo Crinone 8%. Crinone chứa một loại hormone gọi là progesterone. Khi nào gel được đưa vào âm đạo, progesterone là từ từ giải phóng vào máu trong suốt cả ngày."
drug_1213,Trong những trường hợp nào Agimycob thường được sử dụng để điều trị?,Agimycob thường được sử dụng để điều trị viêm âm đạo do các mầm bệnh nhạy cảm gây ra và viêm âm đạo không đặc hiệu do các nguyên nhân đơn lẻ hay phối hợp.,Thuốc thường được sử dụng để điều trị viêm âm đạo do các mầm bệnh nhạy cảm gây ra và viêm âm đạo không đặc hiệu do các nguyên nhân đơn lẻ hay phối hợp.
drug_3726,Việc dùng Atocib 90 ảnh hưởng như thế nào đến tình trạng mất ngủ?,Có thể gây mất ngủ.,"- Các tình trạng nhiễm khuẩn, ký sinh trùng: viêm dạ dày ruột, nhiễm khuẩn hô hấp trên, nhiễm khuẩn đường tiết niệu.
- Thiếu máu có kèm hoặc không kèm chảy máu tiêu hóa, giảm bạch cầu, giảm tiểu cầu.
- Phản ứng quá mẫn do rối loạn miễn dịch.
- Rối loạn vị giác, tăng cân.
- Các rối loạn tâm thần như: lo lắng, giảm nhạy bén, trầm cảm, ảo giác.
- Mất ngủ, lơ mơ, buồn ngủ, dị cảm.
- Viêm kết mạc.
- Ù tai, chóng mặt, nhìn không rõ.
- Loạn nhịp nhĩ, nhịp tim nhanh, suy tim sung huyết, nhồi máu cơ tim, thay đổi ECG không rõ ràng, đau thắt ngực.
- Mặt đỏ, thiếu máu cục bộ thoáng qua, tăng huyết áp, viêm mạch, tai biến mạch máu não.
- Ho, khó thở, chảy máu cam.
- Các rối loạn tiêu hóa: căng bụng, thay đổi nhu động ruột, khô miệng, thủng ruột kèm chảy máu, hội chứng ruột kích thích, loét tá tràng, viêm tụy.
- Các vấn đề về da như: sưng mặt, ngứa, phát ban, nổi ban đỏ, nổi mày đay.
- Cảm giác vọp bẻ, đau cơ xương.
- Tiểu protein (tiểu đạm), tăng creatinin trong máu, suy thận.
- Nồng độ nitrogen huyết thanh, creatinin phosphokinase, kali máu, acid uric máu đều tăng."
drug_7997,Tác động của Chloramphenicol đối với trẻ bú mẹ là gì?,Chloramphenicol gây suy tủy xương và xám ở trẻ bú mẹ.,"Cloramphenicol được phân bố vào trong sữa. Do đó, không sử dụng cho phụ nữ đang cho con bú vì có thể gây suy tủy xương ở trẻ. Nồng độ thuốc trong sữa mẹ thường không đủ để gây hội chứng xám cho con."
drug_3989,Cần tránh không được tự ý làm gì khi quên liều thuốc Audocals?,Cần tránh không được tự ý tăng liều để bổ sung liều đã quên.,"Nếu bạn quên liều Audocals, hãy uống ngay khi nhớ ra nếu thời gian còn cách xa liều kế tiếp. Ngược lại, bạn hãy bỏ qua liều đã quên nếu sắp đến thời gian uống liều kế. Tuyệt đối không được tự ý tăng liều để bổ sung liều đã quên."
drug_7337,Tại sao không nên sử dụng Cebrex cho trẻ em dưới 12 tuổi?,Không nên sử dụng Cebrex cho trẻ em dưới 12 tuổi vì chưa có đầy đủ dữ liệu về độ an toàn và hiệu quả của thuốc đối với đối tượng này.,"Không dùng Cebrex với các đối tượng sau: - Trẻ em dưới 12 tuổi.
- Người có rối loạn đông máu, đang có xuất huyết.
- Người mẫn cảm với bất cứ thành phần nào của thuốc."
drug_5611,Có thể dùng thuốc Betex không nếu đang mang thai hoặc cho con bú?,Phụ women đang mang thai hoặc cho con bú có thể dùng thuốc Betex nhưng cần tham khảo đơn thuốc từ bác sĩ. Nhà cung ứng không chịu trách nhiệm với các hậu quả do dùng thuốc mà không có hướng dẫn của bác sĩ hoặc dược sĩ.,"- Phụ nữ có thai: thuốc Betex rất ít có khả năng gây tổn thương trên bào thai. Tuy nhiên cũng như các thuốc khác, chỉ nên sử dụng trong thời kỳ này khi thật cần thiết.
- Phụ nữ đang cho con bú: thận trọng khi dùng thuốc này cho phụ nữ đang cho con bú. Trước khi sử dụng bất cứ thuốc nào trong thời kỳ này, bạn cũng cần hỏi ý kiến bác sĩ, dược sĩ để đảm bảo an toàn. "
drug_8508,"Vì sao phải theo dõi chức năng gan, thận và thực hiện xét nghiệm máu định kỳ khi sử dụng Clindamycin trong thời gian dài?","Khi sử dụng Clindamycin trong thời gian dài cần theo dõi chức năng gan, thận và thực  hiện xét nghiệm máu định kỳ để đảm bảo an toàn cho người bệnh.","Clindamycin tích lũy ở những tình trạng nặng. Do đó phải điều chỉnh liều dùng. Nếu sử dụng trong thời gian dài, cần theo dõi định kỳ chức năng gan, thận và thực hiện xét nghiệm máu."
drug_4922,Sản phẩm Barudon có những dạng đóng gói nào?,"Barudon được đóng gói dưới dạng hộp, mỗi hộp gồm 20 gói bột sủi x 10ml.","Hiện nay, Barudon có giá khoảng 76.000 VNĐ/hộp 20 gói x 10ml. Giá bán lẻ cho mỗi gói dao động khoảng từ 3.400 VNĐ – 3.800 VNĐ.1 Lưu ý, mức giá chỉ mang tính chất tham khảo. Giá sản phẩm có thể thay đổi tùy thời điểm bán cũng như cơ sở bán lẻ."
drug_3404,Trong trường hợp nào bệnh nhân không được nghiền nát thuốc Aspirin MKP 81 và phải uống nguyên viên?,Bệnh nhân không được nghiền nát thuốc Aspirin MKP 81 và phải uống nguyên viên trong trường hợp đang điều trị các vấn đề về dạ dày tàu ruột như loét dạ dày tá tràng hay xuất huyết tiêu hóa.,Aspirin MKP 81 được sử dụng qua đường uống. Uống nguyên viên với nước lọc và không được nghiền hoặc nhai thuốc. Nên uống thuốc sau khi ăn.
drug_4799,Thuốc Banitase được sử dụng theo đường nào?,Thuốc Banitase được sử dụng qua đường uống.,"Banitase được sử dụng qua đường uống. Để hiệu quả điều trị được tối ưu, nên sử dụng thuốc trước khi ăn."
drug_1048,"Nếu có vấn đề liên quan đến việc sử dụng thuốc Aescin, thì nên hỏi han và tham khảo những ai?","Nếu có bất cứ vấn đề gì liên quan đến việc sử dụng thuốc Aescin, thì hãy hỏi han và tham khảo bác sĩ hay dược sĩ để được tư vấn cụ thể và chính xác nhất.","Bảo quản thuốc Aescin tại nơi khô ráo, ở nhiệt độ dưới 30°C, tránh ánh nắng mặt trời trực tiếp chiếu vào thuốc. Nên cất trữ thuốc ở nơi an toàn, cách xa tầm tay của trẻ em và vật nuôi. Thuốc Aescin được sử dụng để điều trị giãn hoặc viêm tĩnh mạch chân, điều trị trĩ, phòng và điều trị tụ máu, chống viêm, chống phù nề sau phẫu thuật và chấn thương. Trên đây là những thông tin tham khảo từ YouMed về thuốc Aescin. Nếu có bất cứ vấn đề gì liên quan, bạn hãy liên hệ với bác sĩ hay dược sĩ để được tư vấn cụ thể."
drug_3245,"Khi sử dụng Artrodar, tôi có thể lái xe hay vận hành máy móc không?","Có, khi sử dụng Artrodar, bạn vẫn có thể lái xe và vận hành máy móc bình thường.",Artrodar không ảnh hưởng đến khả năng láy xe và máy móc.
drug_5203,Nêu các phản ứng dị ứng nghiêm trọng khi sử dụng thuốc bôi benzalkonium chloride.,"Thuốc bôi benzalkonium chloride có thể gây ra các phản ứng dị ứng nghiêm trọng như: phát ban, nổi mề đay và ngứa; khó thở, tức ngực; sưng miệng, mặt, môi hoặc lưỡi.","Xuất hiện cảm giác khó chịu ở khu vực điều trị. Đến bệnh viện ngay lập tức nếu có những tác dụng phụ nặng xảy ra trong khi dùng thuốc bôi benzalkonium chloride: Các phản ứng dị ứng nặng bao gồm các triệu chứng: - Phát ban, nổi mề đay; ngứa.
- Khó thở, tức ngực.
- Sưng miệng, mặt, môi, hoặc lưỡi."
